{
  "$schema": "https://json-schema.org/draft/2020-12/schema",
  "$id": "https://fluidsbench.org/schemas/v1/profile-index.schema.json",
  "title": "FluidsBench profile index",
  "type": "object",
  "additionalProperties": false,
  "required": ["schema_version", "submission_id", "dataset_id", "split_id", "case_set_id", "case_count", "chunks"],
  "properties": {
    "schema_version": {"const": "1.0"},
    "format": {
      "enum": [
        "fluidsbench-profile-chunks-v1",
        "fluidsbench-drivaerml-physical-profile-chunks-v1",
        "fluidsbench-drivaerml-relative-profile-chunks-v3-candidate",
        "fluidsbench-hiliftaeroml-compact-profile-chunks-v2-candidate"
      ]
    },
    "contract_id": {"type": "string", "minLength": 1},
    "contract_sha256": {"type": "string", "pattern": "^[a-f0-9]{64}$"},
    "evaluator_support_release_id": {"type": "string", "pattern": "^[a-z0-9][a-z0-9._-]{0,159}$"},
    "evaluator_support_manifest_sha256": {"type": "string", "pattern": "^[a-f0-9]{64}$"},
    "submission_id": {"type": "string", "minLength": 1},
    "dataset_id": {"type": "string", "minLength": 1},
    "split_id": {"type": "string", "minLength": 1},
    "case_set_id": {"type": "string", "minLength": 1},
    "case_count": {"type": "integer", "minimum": 1},
    "case_id_status": {"enum": ["official", "official_intersected_with_published", "prototype_generated"]},
    "chunks": {
      "type": "array",
      "minItems": 1,
      "items": {
        "type": "object",
        "additionalProperties": false,
        "required": ["file", "case_ids", "sha256"],
        "properties": {
          "file": {"type": "string", "pattern": "^chunk-[0-9]{3}\\.json$"},
          "case_ids": {"type": "array", "minItems": 1, "uniqueItems": true, "items": {"type": "string", "minLength": 1}},
          "sha256": {"type": "string", "pattern": "^[a-f0-9]{64}$"}
        }
      }
    }
  },
  "allOf": [
    {
      "if": {
        "properties": {
          "format": {
            "enum": [
              "fluidsbench-drivaerml-relative-profile-chunks-v3-candidate",
              "fluidsbench-hiliftaeroml-compact-profile-chunks-v2-candidate"
            ]
          }
        },
        "required": ["format"]
      },
      "then": {
        "required": ["format", "contract_id", "contract_sha256"]
      },
      "else": {
        "not": {
          "anyOf": [
            {"required": ["contract_id"]},
            {"required": ["contract_sha256"]}
          ]
        }
      }
    },
    {
      "if": {
        "properties": {
          "format": {
            "const": "fluidsbench-hiliftaeroml-compact-profile-chunks-v2-candidate"
          }
        },
        "required": ["format"]
      },
      "then": {
        "required": [
          "evaluator_support_release_id",
          "evaluator_support_manifest_sha256"
        ]
      },
      "else": {
        "not": {
          "anyOf": [
            {"required": ["evaluator_support_release_id"]},
            {"required": ["evaluator_support_manifest_sha256"]}
          ]
        }
      }
    }
  ]
}
