{
  "schema_version": "1.0",
  "submission_id": "windsorml-oformer",
  "dataset_id": "windsorml",
  "split_id": "default",
  "case_set_id": "default",
  "case_count": 1,
  "case_id_status": "prototype_generated",
  "chunks": [
    {
      "file": "chunk-000.json",
      "case_ids": [
        "windsorml_default_test_0001"
      ],
      "sha256": "a4eda88a7bb42b700d647641d267f736bc95c9a535abaff8e2b80a5e7eb2c225"
    }
  ]
}
