{
  "schema_version": "1.0",
  "submission_id": "vkils59-prototype-train-8",
  "dataset_id": "vki-ls59",
  "split_id": "train_8",
  "case_set_id": "official_test",
  "case_count": 168,
  "case_id_status": "prototype_generated",
  "chunks": [
    {
      "file": "chunk-000.json",
      "case_ids": [
        "vki-ls59_official_test_0001",
        "vki-ls59_official_test_0002",
        "vki-ls59_official_test_0003",
        "vki-ls59_official_test_0004",
        "vki-ls59_official_test_0005",
        "vki-ls59_official_test_0006",
        "vki-ls59_official_test_0007",
        "vki-ls59_official_test_0008",
        "vki-ls59_official_test_0009",
        "vki-ls59_official_test_0010",
        "vki-ls59_official_test_0011",
        "vki-ls59_official_test_0012",
        "vki-ls59_official_test_0013",
        "vki-ls59_official_test_0014",
        "vki-ls59_official_test_0015",
        "vki-ls59_official_test_0016",
        "vki-ls59_official_test_0017",
        "vki-ls59_official_test_0018",
        "vki-ls59_official_test_0019",
        "vki-ls59_official_test_0020",
        "vki-ls59_official_test_0021",
        "vki-ls59_official_test_0022",
        "vki-ls59_official_test_0023",
        "vki-ls59_official_test_0024",
        "vki-ls59_official_test_0025",
        "vki-ls59_official_test_0026",
        "vki-ls59_official_test_0027",
        "vki-ls59_official_test_0028",
        "vki-ls59_official_test_0029",
        "vki-ls59_official_test_0030"
      ],
      "sha256": "80600af91fdd97a3d1068993b53e559edbc5079504d1dee8318756b8cd04aac1"
    },
    {
      "file": "chunk-001.json",
      "case_ids": [
        "vki-ls59_official_test_0031",
        "vki-ls59_official_test_0032",
        "vki-ls59_official_test_0033",
        "vki-ls59_official_test_0034",
        "vki-ls59_official_test_0035",
        "vki-ls59_official_test_0036",
        "vki-ls59_official_test_0037",
        "vki-ls59_official_test_0038",
        "vki-ls59_official_test_0039",
        "vki-ls59_official_test_0040",
        "vki-ls59_official_test_0041",
        "vki-ls59_official_test_0042",
        "vki-ls59_official_test_0043",
        "vki-ls59_official_test_0044",
        "vki-ls59_official_test_0045",
        "vki-ls59_official_test_0046",
        "vki-ls59_official_test_0047",
        "vki-ls59_official_test_0048",
        "vki-ls59_official_test_0049",
        "vki-ls59_official_test_0050",
        "vki-ls59_official_test_0051",
        "vki-ls59_official_test_0052",
        "vki-ls59_official_test_0053",
        "vki-ls59_official_test_0054",
        "vki-ls59_official_test_0055",
        "vki-ls59_official_test_0056",
        "vki-ls59_official_test_0057",
        "vki-ls59_official_test_0058",
        "vki-ls59_official_test_0059",
        "vki-ls59_official_test_0060"
      ],
      "sha256": "6ecb64fdb00da65457c68c7391bb1c8b47103f2eb70170dedbadcc8bb64489ec"
    },
    {
      "file": "chunk-002.json",
      "case_ids": [
        "vki-ls59_official_test_0061",
        "vki-ls59_official_test_0062",
        "vki-ls59_official_test_0063",
        "vki-ls59_official_test_0064",
        "vki-ls59_official_test_0065",
        "vki-ls59_official_test_0066",
        "vki-ls59_official_test_0067",
        "vki-ls59_official_test_0068",
        "vki-ls59_official_test_0069",
        "vki-ls59_official_test_0070",
        "vki-ls59_official_test_0071",
        "vki-ls59_official_test_0072",
        "vki-ls59_official_test_0073",
        "vki-ls59_official_test_0074",
        "vki-ls59_official_test_0075",
        "vki-ls59_official_test_0076",
        "vki-ls59_official_test_0077",
        "vki-ls59_official_test_0078",
        "vki-ls59_official_test_0079",
        "vki-ls59_official_test_0080",
        "vki-ls59_official_test_0081",
        "vki-ls59_official_test_0082",
        "vki-ls59_official_test_0083",
        "vki-ls59_official_test_0084",
        "vki-ls59_official_test_0085",
        "vki-ls59_official_test_0086",
        "vki-ls59_official_test_0087",
        "vki-ls59_official_test_0088",
        "vki-ls59_official_test_0089",
        "vki-ls59_official_test_0090"
      ],
      "sha256": "3069ddf4bb61187430f3316280a94091c6f252e61954b3d16205daa339c3de31"
    },
    {
      "file": "chunk-003.json",
      "case_ids": [
        "vki-ls59_official_test_0091",
        "vki-ls59_official_test_0092",
        "vki-ls59_official_test_0093",
        "vki-ls59_official_test_0094",
        "vki-ls59_official_test_0095",
        "vki-ls59_official_test_0096",
        "vki-ls59_official_test_0097",
        "vki-ls59_official_test_0098",
        "vki-ls59_official_test_0099",
        "vki-ls59_official_test_0100",
        "vki-ls59_official_test_0101",
        "vki-ls59_official_test_0102",
        "vki-ls59_official_test_0103",
        "vki-ls59_official_test_0104",
        "vki-ls59_official_test_0105",
        "vki-ls59_official_test_0106",
        "vki-ls59_official_test_0107",
        "vki-ls59_official_test_0108",
        "vki-ls59_official_test_0109",
        "vki-ls59_official_test_0110",
        "vki-ls59_official_test_0111",
        "vki-ls59_official_test_0112",
        "vki-ls59_official_test_0113",
        "vki-ls59_official_test_0114",
        "vki-ls59_official_test_0115",
        "vki-ls59_official_test_0116",
        "vki-ls59_official_test_0117",
        "vki-ls59_official_test_0118",
        "vki-ls59_official_test_0119",
        "vki-ls59_official_test_0120"
      ],
      "sha256": "1b8d62c92a521ed0f6435e98e857fe356f92515aae17cbcde61cd7451cce333d"
    },
    {
      "file": "chunk-004.json",
      "case_ids": [
        "vki-ls59_official_test_0121",
        "vki-ls59_official_test_0122",
        "vki-ls59_official_test_0123",
        "vki-ls59_official_test_0124",
        "vki-ls59_official_test_0125",
        "vki-ls59_official_test_0126",
        "vki-ls59_official_test_0127",
        "vki-ls59_official_test_0128",
        "vki-ls59_official_test_0129",
        "vki-ls59_official_test_0130",
        "vki-ls59_official_test_0131",
        "vki-ls59_official_test_0132",
        "vki-ls59_official_test_0133",
        "vki-ls59_official_test_0134",
        "vki-ls59_official_test_0135",
        "vki-ls59_official_test_0136",
        "vki-ls59_official_test_0137",
        "vki-ls59_official_test_0138",
        "vki-ls59_official_test_0139",
        "vki-ls59_official_test_0140",
        "vki-ls59_official_test_0141",
        "vki-ls59_official_test_0142",
        "vki-ls59_official_test_0143",
        "vki-ls59_official_test_0144",
        "vki-ls59_official_test_0145",
        "vki-ls59_official_test_0146",
        "vki-ls59_official_test_0147",
        "vki-ls59_official_test_0148",
        "vki-ls59_official_test_0149",
        "vki-ls59_official_test_0150"
      ],
      "sha256": "9b4873a61a5e9899aca42fe5bc67a996571ba11186c7b56f15c086cf3482ef70"
    },
    {
      "file": "chunk-005.json",
      "case_ids": [
        "vki-ls59_official_test_0151",
        "vki-ls59_official_test_0152",
        "vki-ls59_official_test_0153",
        "vki-ls59_official_test_0154",
        "vki-ls59_official_test_0155",
        "vki-ls59_official_test_0156",
        "vki-ls59_official_test_0157",
        "vki-ls59_official_test_0158",
        "vki-ls59_official_test_0159",
        "vki-ls59_official_test_0160",
        "vki-ls59_official_test_0161",
        "vki-ls59_official_test_0162",
        "vki-ls59_official_test_0163",
        "vki-ls59_official_test_0164",
        "vki-ls59_official_test_0165",
        "vki-ls59_official_test_0166",
        "vki-ls59_official_test_0167",
        "vki-ls59_official_test_0168"
      ],
      "sha256": "fed8fe05a32f2d613249fa9396174f89ba5d0a1e9637c02c9f69cc49687786da"
    }
  ]
}
