{
  "schema_version": "1.0",
  "submission_id": "windsorml-ab-upt",
  "dataset_id": "windsorml",
  "split_id": "default",
  "case_set_id": "default",
  "case_count": 1,
  "case_id_status": "prototype_generated",
  "chunks": [
    {
      "file": "chunk-000.json",
      "case_ids": [
        "windsorml_default_test_0001"
      ],
      "sha256": "3f9570d6f4365d10578ebadb0d88fbb0f03cb779cf445946087b0ff79a53cc0a"
    }
  ]
}
