{
  "schema_version": "1.0",
  "submission_id": "drivaerml-lno",
  "dataset_id": "drivaerml",
  "split_id": "super_scarce",
  "case_set_id": "standard",
  "case_count": 50,
  "case_id_status": "official",
  "chunks": [
    {
      "file": "chunk-000.json",
      "case_ids": [
        "run_11",
        "run_12",
        "run_19",
        "run_20",
        "run_24"
      ],
      "sha256": "994d33ba497ca74a1d18140b683ee8a5243723a8d9fac10545ec80c54321cc2d"
    },
    {
      "file": "chunk-001.json",
      "case_ids": [
        "run_26",
        "run_29",
        "run_41",
        "run_55",
        "run_59"
      ],
      "sha256": "abb0a3963fa09a0dc222302d4dcc798c35729b75f7aac9f3f43ed48762acb4d3"
    },
    {
      "file": "chunk-002.json",
      "case_ids": [
        "run_108",
        "run_124",
        "run_127",
        "run_133",
        "run_142"
      ],
      "sha256": "870f6a8404277e20e2f9c9b28a27559a293f49cc96dcd1d9768f9d4646232f78"
    },
    {
      "file": "chunk-003.json",
      "case_ids": [
        "run_158",
        "run_173",
        "run_180",
        "run_187",
        "run_188"
      ],
      "sha256": "faeeda196968a051def2cdf33fd27bc5c6f7a93b60b3afb16aa04b450528652f"
    },
    {
      "file": "chunk-004.json",
      "case_ids": [
        "run_197",
        "run_199",
        "run_203",
        "run_205",
        "run_207"
      ],
      "sha256": "5d0ff6c0e74a22e7b4ed166b2fd82812ebae85b51f6208cb85e159cf6267cc18"
    },
    {
      "file": "chunk-005.json",
      "case_ids": [
        "run_208",
        "run_210",
        "run_215",
        "run_222",
        "run_226"
      ],
      "sha256": "1c8504787da671b87d57bb7395f17d1256a8fc280c5292485ef8e6f5e30cdefc"
    },
    {
      "file": "chunk-006.json",
      "case_ids": [
        "run_258",
        "run_263",
        "run_280",
        "run_284",
        "run_290"
      ],
      "sha256": "481c4e7fe56177a4553078aaf8d60f5e6162047e46e70149666ae0d64672f75e"
    },
    {
      "file": "chunk-007.json",
      "case_ids": [
        "run_322",
        "run_337",
        "run_350",
        "run_354",
        "run_363"
      ],
      "sha256": "26df11ac946b1b7328d87c689bfed41d430c8d20827c6706e91234ce0a04c0a2"
    },
    {
      "file": "chunk-008.json",
      "case_ids": [
        "run_372",
        "run_382",
        "run_387",
        "run_405",
        "run_410"
      ],
      "sha256": "c6c8a96a74993bf3687d66dea87bcffdb1b5026f28ab75381626d49284921732"
    },
    {
      "file": "chunk-009.json",
      "case_ids": [
        "run_424",
        "run_428",
        "run_429",
        "run_436",
        "run_472"
      ],
      "sha256": "38bafb191f76069991c6fc1c2621d84a8f1895bdf11b7f6f416da31399466104"
    }
  ]
}
