{
  "schema_version": "1.0",
  "submission_id": "drivaernetpp-transolver-large",
  "dataset_id": "drivaernetplusplus",
  "split_id": "default",
  "case_set_id": "default",
  "case_count": 1,
  "case_id_status": "prototype_generated",
  "chunks": [
    {
      "file": "chunk-000.json",
      "case_ids": [
        "drivaernetplusplus_default_test_0001"
      ],
      "sha256": "4011e29f572a2be04c58d7fe1061a278f1d05c26298a5b8d6b2bbe48478351e2"
    }
  ]
}
