{
  "schema_version": "1.0",
  "submission_id": "windsorml-transolver",
  "dataset_id": "windsorml",
  "split_id": "default",
  "case_set_id": "default",
  "case_count": 1,
  "case_id_status": "prototype_generated",
  "chunks": [
    {
      "file": "chunk-000.json",
      "case_ids": [
        "windsorml_default_test_0001"
      ],
      "sha256": "4bb2c1025ebb0033b0df746c7168f8a1387dedd2fd41d8737ed5f3e5efd8bb5a"
    }
  ]
}
