{
  "schema_version": "1.0",
  "submission_id": "windsorml-lno",
  "dataset_id": "windsorml",
  "split_id": "default",
  "case_set_id": "default",
  "case_count": 1,
  "case_id_status": "prototype_generated",
  "chunks": [
    {
      "file": "chunk-000.json",
      "case_ids": [
        "windsorml_default_test_0001"
      ],
      "sha256": "2e4825af42fac60ac647c83505d5c8f01c9aa43daaf81d1b5fae0044a11bf6e3"
    }
  ]
}
