{
  "schema_version": "1.0",
  "submission_id": "drivaerml-oformer",
  "dataset_id": "drivaerml",
  "split_id": "high_drag",
  "case_set_id": "high_drag",
  "case_count": 97,
  "case_id_status": "official",
  "chunks": [
    {
      "file": "chunk-000.json",
      "case_ids": [
        "run_1",
        "run_8",
        "run_11",
        "run_14",
        "run_18",
        "run_19",
        "run_22",
        "run_29",
        "run_39",
        "run_44",
        "run_47",
        "run_49",
        "run_53",
        "run_56",
        "run_69",
        "run_77",
        "run_78",
        "run_79",
        "run_82",
        "run_88",
        "run_108",
        "run_112",
        "run_115",
        "run_122",
        "run_123",
        "run_126",
        "run_129",
        "run_132",
        "run_135",
        "run_138"
      ],
      "sha256": "9a2768a11f862fde61143b5ff5fa9859b7c1caec51209c8f4fbb44f0e1bde049"
    },
    {
      "file": "chunk-001.json",
      "case_ids": [
        "run_143",
        "run_148",
        "run_155",
        "run_163",
        "run_165",
        "run_173",
        "run_181",
        "run_184",
        "run_186",
        "run_190",
        "run_196",
        "run_204",
        "run_206",
        "run_210",
        "run_216",
        "run_219",
        "run_226",
        "run_234",
        "run_239",
        "run_243",
        "run_245",
        "run_247",
        "run_250",
        "run_258",
        "run_275",
        "run_277",
        "run_292",
        "run_299",
        "run_303",
        "run_307"
      ],
      "sha256": "f7fc9826efb578074b9645eddf9981b75ab4361df649fe44132eb934272238b2"
    },
    {
      "file": "chunk-002.json",
      "case_ids": [
        "run_318",
        "run_320",
        "run_324",
        "run_333",
        "run_343",
        "run_350",
        "run_352",
        "run_357",
        "run_360",
        "run_367",
        "run_371",
        "run_377",
        "run_379",
        "run_381",
        "run_387",
        "run_390",
        "run_391",
        "run_408",
        "run_412",
        "run_414",
        "run_417",
        "run_420",
        "run_429",
        "run_431",
        "run_436",
        "run_439",
        "run_445",
        "run_452",
        "run_454",
        "run_461"
      ],
      "sha256": "e199d0cbcd90c1ad66883407a6de9f8809e8ec291808e8e2c06379035bc62427"
    },
    {
      "file": "chunk-003.json",
      "case_ids": [
        "run_465",
        "run_469",
        "run_477",
        "run_490",
        "run_491",
        "run_495",
        "run_500"
      ],
      "sha256": "53f119c8fa5c053db5c17f64caf058ef4f045176c67939879894a6b7f6d25280"
    }
  ]
}
