{
  "schema_version": "1.0",
  "submission_id": "ab-upt",
  "dataset_id": "ahmedml",
  "split_id": "full",
  "case_set_id": "standard",
  "case_count": 50,
  "case_id_status": "prototype_generated",
  "chunks": [
    {
      "file": "chunk-000.json",
      "case_ids": [
        "ahmedml_standard_test_0001",
        "ahmedml_standard_test_0002",
        "ahmedml_standard_test_0003",
        "ahmedml_standard_test_0004",
        "ahmedml_standard_test_0005",
        "ahmedml_standard_test_0006",
        "ahmedml_standard_test_0007",
        "ahmedml_standard_test_0008",
        "ahmedml_standard_test_0009",
        "ahmedml_standard_test_0010",
        "ahmedml_standard_test_0011",
        "ahmedml_standard_test_0012",
        "ahmedml_standard_test_0013",
        "ahmedml_standard_test_0014",
        "ahmedml_standard_test_0015",
        "ahmedml_standard_test_0016",
        "ahmedml_standard_test_0017",
        "ahmedml_standard_test_0018",
        "ahmedml_standard_test_0019",
        "ahmedml_standard_test_0020",
        "ahmedml_standard_test_0021",
        "ahmedml_standard_test_0022",
        "ahmedml_standard_test_0023",
        "ahmedml_standard_test_0024",
        "ahmedml_standard_test_0025",
        "ahmedml_standard_test_0026",
        "ahmedml_standard_test_0027",
        "ahmedml_standard_test_0028",
        "ahmedml_standard_test_0029",
        "ahmedml_standard_test_0030"
      ],
      "sha256": "24011a141cb7355c1b820092bca7ba05c4e77bbde78b496701d02e57523244a4"
    },
    {
      "file": "chunk-001.json",
      "case_ids": [
        "ahmedml_standard_test_0031",
        "ahmedml_standard_test_0032",
        "ahmedml_standard_test_0033",
        "ahmedml_standard_test_0034",
        "ahmedml_standard_test_0035",
        "ahmedml_standard_test_0036",
        "ahmedml_standard_test_0037",
        "ahmedml_standard_test_0038",
        "ahmedml_standard_test_0039",
        "ahmedml_standard_test_0040",
        "ahmedml_standard_test_0041",
        "ahmedml_standard_test_0042",
        "ahmedml_standard_test_0043",
        "ahmedml_standard_test_0044",
        "ahmedml_standard_test_0045",
        "ahmedml_standard_test_0046",
        "ahmedml_standard_test_0047",
        "ahmedml_standard_test_0048",
        "ahmedml_standard_test_0049",
        "ahmedml_standard_test_0050"
      ],
      "sha256": "ce77dfd5b2c32f754187ff255d1187b06c16e9735b24402febb42513e0658100"
    }
  ]
}
