{
  "schema_version": "1.0",
  "submission_id": "rotor37-prototype-train-32",
  "dataset_id": "rotor37",
  "split_id": "train_32",
  "case_set_id": "official_test",
  "case_count": 200,
  "case_id_status": "prototype_generated",
  "chunks": [
    {
      "file": "chunk-000.json",
      "case_ids": [
        "rotor37_official_test_0001",
        "rotor37_official_test_0002",
        "rotor37_official_test_0003",
        "rotor37_official_test_0004",
        "rotor37_official_test_0005",
        "rotor37_official_test_0006",
        "rotor37_official_test_0007",
        "rotor37_official_test_0008",
        "rotor37_official_test_0009",
        "rotor37_official_test_0010",
        "rotor37_official_test_0011",
        "rotor37_official_test_0012",
        "rotor37_official_test_0013",
        "rotor37_official_test_0014",
        "rotor37_official_test_0015",
        "rotor37_official_test_0016",
        "rotor37_official_test_0017",
        "rotor37_official_test_0018",
        "rotor37_official_test_0019",
        "rotor37_official_test_0020",
        "rotor37_official_test_0021",
        "rotor37_official_test_0022",
        "rotor37_official_test_0023",
        "rotor37_official_test_0024",
        "rotor37_official_test_0025",
        "rotor37_official_test_0026",
        "rotor37_official_test_0027",
        "rotor37_official_test_0028",
        "rotor37_official_test_0029",
        "rotor37_official_test_0030"
      ],
      "sha256": "dc2e5c21ee1f0e50dbf36c5eae4adb5b870b7cd726004b78875bc9c840ac5d58"
    },
    {
      "file": "chunk-001.json",
      "case_ids": [
        "rotor37_official_test_0031",
        "rotor37_official_test_0032",
        "rotor37_official_test_0033",
        "rotor37_official_test_0034",
        "rotor37_official_test_0035",
        "rotor37_official_test_0036",
        "rotor37_official_test_0037",
        "rotor37_official_test_0038",
        "rotor37_official_test_0039",
        "rotor37_official_test_0040",
        "rotor37_official_test_0041",
        "rotor37_official_test_0042",
        "rotor37_official_test_0043",
        "rotor37_official_test_0044",
        "rotor37_official_test_0045",
        "rotor37_official_test_0046",
        "rotor37_official_test_0047",
        "rotor37_official_test_0048",
        "rotor37_official_test_0049",
        "rotor37_official_test_0050",
        "rotor37_official_test_0051",
        "rotor37_official_test_0052",
        "rotor37_official_test_0053",
        "rotor37_official_test_0054",
        "rotor37_official_test_0055",
        "rotor37_official_test_0056",
        "rotor37_official_test_0057",
        "rotor37_official_test_0058",
        "rotor37_official_test_0059",
        "rotor37_official_test_0060"
      ],
      "sha256": "cb9d2f445cfac62b683b0c06cd5b65ceff49b432e9badb230527f2a3d797ff6c"
    },
    {
      "file": "chunk-002.json",
      "case_ids": [
        "rotor37_official_test_0061",
        "rotor37_official_test_0062",
        "rotor37_official_test_0063",
        "rotor37_official_test_0064",
        "rotor37_official_test_0065",
        "rotor37_official_test_0066",
        "rotor37_official_test_0067",
        "rotor37_official_test_0068",
        "rotor37_official_test_0069",
        "rotor37_official_test_0070",
        "rotor37_official_test_0071",
        "rotor37_official_test_0072",
        "rotor37_official_test_0073",
        "rotor37_official_test_0074",
        "rotor37_official_test_0075",
        "rotor37_official_test_0076",
        "rotor37_official_test_0077",
        "rotor37_official_test_0078",
        "rotor37_official_test_0079",
        "rotor37_official_test_0080",
        "rotor37_official_test_0081",
        "rotor37_official_test_0082",
        "rotor37_official_test_0083",
        "rotor37_official_test_0084",
        "rotor37_official_test_0085",
        "rotor37_official_test_0086",
        "rotor37_official_test_0087",
        "rotor37_official_test_0088",
        "rotor37_official_test_0089",
        "rotor37_official_test_0090"
      ],
      "sha256": "28465a1657018bca17cd120083df247fb55a35b2b409dba62389bcade2a0c3a2"
    },
    {
      "file": "chunk-003.json",
      "case_ids": [
        "rotor37_official_test_0091",
        "rotor37_official_test_0092",
        "rotor37_official_test_0093",
        "rotor37_official_test_0094",
        "rotor37_official_test_0095",
        "rotor37_official_test_0096",
        "rotor37_official_test_0097",
        "rotor37_official_test_0098",
        "rotor37_official_test_0099",
        "rotor37_official_test_0100",
        "rotor37_official_test_0101",
        "rotor37_official_test_0102",
        "rotor37_official_test_0103",
        "rotor37_official_test_0104",
        "rotor37_official_test_0105",
        "rotor37_official_test_0106",
        "rotor37_official_test_0107",
        "rotor37_official_test_0108",
        "rotor37_official_test_0109",
        "rotor37_official_test_0110",
        "rotor37_official_test_0111",
        "rotor37_official_test_0112",
        "rotor37_official_test_0113",
        "rotor37_official_test_0114",
        "rotor37_official_test_0115",
        "rotor37_official_test_0116",
        "rotor37_official_test_0117",
        "rotor37_official_test_0118",
        "rotor37_official_test_0119",
        "rotor37_official_test_0120"
      ],
      "sha256": "07d551fd0e20fa92f204dd91144b8bc2173bc5555bf4286b186f231fe9fb4420"
    },
    {
      "file": "chunk-004.json",
      "case_ids": [
        "rotor37_official_test_0121",
        "rotor37_official_test_0122",
        "rotor37_official_test_0123",
        "rotor37_official_test_0124",
        "rotor37_official_test_0125",
        "rotor37_official_test_0126",
        "rotor37_official_test_0127",
        "rotor37_official_test_0128",
        "rotor37_official_test_0129",
        "rotor37_official_test_0130",
        "rotor37_official_test_0131",
        "rotor37_official_test_0132",
        "rotor37_official_test_0133",
        "rotor37_official_test_0134",
        "rotor37_official_test_0135",
        "rotor37_official_test_0136",
        "rotor37_official_test_0137",
        "rotor37_official_test_0138",
        "rotor37_official_test_0139",
        "rotor37_official_test_0140",
        "rotor37_official_test_0141",
        "rotor37_official_test_0142",
        "rotor37_official_test_0143",
        "rotor37_official_test_0144",
        "rotor37_official_test_0145",
        "rotor37_official_test_0146",
        "rotor37_official_test_0147",
        "rotor37_official_test_0148",
        "rotor37_official_test_0149",
        "rotor37_official_test_0150"
      ],
      "sha256": "9f01781abd3a256aa8a043c26a59c7390934fa5c6663a5996050a45b8d573096"
    },
    {
      "file": "chunk-005.json",
      "case_ids": [
        "rotor37_official_test_0151",
        "rotor37_official_test_0152",
        "rotor37_official_test_0153",
        "rotor37_official_test_0154",
        "rotor37_official_test_0155",
        "rotor37_official_test_0156",
        "rotor37_official_test_0157",
        "rotor37_official_test_0158",
        "rotor37_official_test_0159",
        "rotor37_official_test_0160",
        "rotor37_official_test_0161",
        "rotor37_official_test_0162",
        "rotor37_official_test_0163",
        "rotor37_official_test_0164",
        "rotor37_official_test_0165",
        "rotor37_official_test_0166",
        "rotor37_official_test_0167",
        "rotor37_official_test_0168",
        "rotor37_official_test_0169",
        "rotor37_official_test_0170",
        "rotor37_official_test_0171",
        "rotor37_official_test_0172",
        "rotor37_official_test_0173",
        "rotor37_official_test_0174",
        "rotor37_official_test_0175",
        "rotor37_official_test_0176",
        "rotor37_official_test_0177",
        "rotor37_official_test_0178",
        "rotor37_official_test_0179",
        "rotor37_official_test_0180"
      ],
      "sha256": "9cad1855a3235ad616cc3fa1117b7ef41d00194b0ade81952e3828c4557af482"
    },
    {
      "file": "chunk-006.json",
      "case_ids": [
        "rotor37_official_test_0181",
        "rotor37_official_test_0182",
        "rotor37_official_test_0183",
        "rotor37_official_test_0184",
        "rotor37_official_test_0185",
        "rotor37_official_test_0186",
        "rotor37_official_test_0187",
        "rotor37_official_test_0188",
        "rotor37_official_test_0189",
        "rotor37_official_test_0190",
        "rotor37_official_test_0191",
        "rotor37_official_test_0192",
        "rotor37_official_test_0193",
        "rotor37_official_test_0194",
        "rotor37_official_test_0195",
        "rotor37_official_test_0196",
        "rotor37_official_test_0197",
        "rotor37_official_test_0198",
        "rotor37_official_test_0199",
        "rotor37_official_test_0200"
      ],
      "sha256": "3b76c819004ae86b37ad89c790318b37fbf2b7b466ada2fb95d6cd38a9fb711c"
    }
  ]
}
