{
  "schema_version": "1.0",
  "submission_id": "drivaernetpp-transolver-plus-plus",
  "dataset_id": "drivaernetplusplus",
  "split_id": "default",
  "case_set_id": "default",
  "case_count": 1,
  "case_id_status": "prototype_generated",
  "chunks": [
    {
      "file": "chunk-000.json",
      "case_ids": [
        "drivaernetplusplus_default_test_0001"
      ],
      "sha256": "be48d101b7a06f5ffc4a98551a5d4dd28c0fede8a3c5c98e58b5a102b5ba9068"
    }
  ]
}
